{
  "schemaVersion": 1,
  "protocolVersion": 1,
  "referenceTime": 1788000000,
  "configuredPairingCode": "TEST-CODE-0001",
  "vectors": [
    {
      "id": "MSG-001",
      "description": "Mac accepts a valid Windows status probe and replies without hardware actions",
      "localPlatform": "mac",
      "input": {
        "encoding": "jsonObject",
        "value": {
          "version": 1,
          "type": "status_probe",
          "eventID": "00000000-0000-4000-8000-000000000001",
          "source": "windows",
          "target": "mac",
          "timestamp": 1788000000,
          "pairingCode": "TEST-CODE-0001"
        }
      },
      "expected": {
        "accepted": true,
        "reason": "accepted",
        "refreshPeer": true,
        "replyTypes": ["status_response"],
        "hardwareCalls": { "wake": 0, "switchDisplay": 0, "usbActions": 0 }
      }
    },
    {
      "id": "MSG-002",
      "description": "Windows accepts a valid Mac status response",
      "localPlatform": "windows",
      "input": {
        "encoding": "jsonObject",
        "value": {
          "version": 1,
          "type": "status_response",
          "eventID": "00000000-0000-4000-8000-000000000002",
          "source": "mac",
          "target": "windows",
          "timestamp": 1788000000,
          "pairingCode": "TEST-CODE-0001",
          "wakeSucceeded": false
        }
      },
      "expected": {
        "accepted": true,
        "reason": "accepted",
        "refreshPeer": true,
        "replyTypes": [],
        "hardwareCalls": { "wake": 0, "switchDisplay": 0, "usbActions": 0 }
      }
    },
    {
      "id": "MSG-003",
      "description": "Unsupported protocol version is rejected",
      "localPlatform": "mac",
      "input": {
        "encoding": "jsonObject",
        "value": {
          "version": 2,
          "type": "status_probe",
          "eventID": "00000000-0000-4000-8000-000000000003",
          "source": "windows",
          "target": "mac",
          "timestamp": 1788000000,
          "pairingCode": "TEST-CODE-0001"
        }
      },
      "expected": {
        "accepted": false,
        "reason": "unsupported_version",
        "refreshPeer": false,
        "replyTypes": [],
        "hardwareCalls": { "wake": 0, "switchDisplay": 0, "usbActions": 0 }
      }
    },
    {
      "id": "MSG-004",
      "description": "Malformed event ID is rejected",
      "localPlatform": "windows",
      "input": {
        "encoding": "jsonObject",
        "value": {
          "version": 1,
          "type": "handover_request",
          "eventID": "not-a-uuid",
          "source": "mac",
          "target": "windows",
          "timestamp": 1788000000,
          "pairingCode": "TEST-CODE-0001"
        }
      },
      "expected": {
        "accepted": false,
        "reason": "invalid_event_id",
        "refreshPeer": false,
        "replyTypes": [],
        "hardwareCalls": { "wake": 0, "switchDisplay": 0, "usbActions": 0 }
      }
    },
    {
      "id": "MSG-005",
      "description": "A timestamp exactly ten seconds old is accepted",
      "localPlatform": "mac",
      "input": {
        "encoding": "jsonObject",
        "value": {
          "version": 1,
          "type": "status_response",
          "eventID": "00000000-0000-4000-8000-000000000005",
          "source": "windows",
          "target": "mac",
          "timestamp": 1787999990,
          "pairingCode": "TEST-CODE-0001"
        }
      },
      "expected": {
        "accepted": true,
        "reason": "accepted",
        "refreshPeer": true,
        "replyTypes": [],
        "hardwareCalls": { "wake": 0, "switchDisplay": 0, "usbActions": 0 }
      }
    },
    {
      "id": "MSG-006",
      "description": "A timestamp more than ten seconds old is rejected",
      "localPlatform": "windows",
      "input": {
        "encoding": "jsonObject",
        "value": {
          "version": 1,
          "type": "status_response",
          "eventID": "00000000-0000-4000-8000-000000000006",
          "source": "mac",
          "target": "windows",
          "timestamp": 1787999989.999,
          "pairingCode": "TEST-CODE-0001"
        }
      },
      "expected": {
        "accepted": false,
        "reason": "timestamp_out_of_window",
        "refreshPeer": false,
        "replyTypes": [],
        "hardwareCalls": { "wake": 0, "switchDisplay": 0, "usbActions": 0 }
      }
    },
    {
      "id": "MSG-007",
      "description": "A timestamp exactly ten seconds in the future is accepted",
      "localPlatform": "windows",
      "input": {
        "encoding": "jsonObject",
        "value": {
          "version": 1,
          "type": "status_response",
          "eventID": "00000000-0000-4000-8000-000000000007",
          "source": "mac",
          "target": "windows",
          "timestamp": 1788000010,
          "pairingCode": "TEST-CODE-0001"
        }
      },
      "expected": {
        "accepted": true,
        "reason": "accepted",
        "refreshPeer": true,
        "replyTypes": [],
        "hardwareCalls": { "wake": 0, "switchDisplay": 0, "usbActions": 0 }
      }
    },
    {
      "id": "MSG-008",
      "description": "A timestamp more than ten seconds in the future is rejected",
      "localPlatform": "mac",
      "input": {
        "encoding": "jsonObject",
        "value": {
          "version": 1,
          "type": "status_probe",
          "eventID": "00000000-0000-4000-8000-000000000008",
          "source": "windows",
          "target": "mac",
          "timestamp": 1788000010.001,
          "pairingCode": "TEST-CODE-0001"
        }
      },
      "expected": {
        "accepted": false,
        "reason": "timestamp_out_of_window",
        "refreshPeer": false,
        "replyTypes": [],
        "hardwareCalls": { "wake": 0, "switchDisplay": 0, "usbActions": 0 }
      }
    },
    {
      "id": "MSG-009",
      "description": "Wrong source and target direction is rejected",
      "localPlatform": "mac",
      "input": {
        "encoding": "jsonObject",
        "value": {
          "version": 1,
          "type": "status_probe",
          "eventID": "00000000-0000-4000-8000-000000000009",
          "source": "mac",
          "target": "windows",
          "timestamp": 1788000000,
          "pairingCode": "TEST-CODE-0001"
        }
      },
      "expected": {
        "accepted": false,
        "reason": "wrong_direction",
        "refreshPeer": false,
        "replyTypes": [],
        "hardwareCalls": { "wake": 0, "switchDisplay": 0, "usbActions": 0 }
      }
    },
    {
      "id": "MSG-010",
      "description": "Pairing code mismatch is rejected",
      "localPlatform": "windows",
      "input": {
        "encoding": "jsonObject",
        "value": {
          "version": 1,
          "type": "status_response",
          "eventID": "00000000-0000-4000-8000-000000000010",
          "source": "mac",
          "target": "windows",
          "timestamp": 1788000000,
          "pairingCode": "WRONG-CODE-0001"
        }
      },
      "expected": {
        "accepted": false,
        "reason": "pairing_mismatch",
        "refreshPeer": false,
        "replyTypes": [],
        "hardwareCalls": { "wake": 0, "switchDisplay": 0, "usbActions": 0 }
      }
    },
    {
      "id": "MSG-011",
      "description": "Unknown message type is rejected before refreshing peer liveness",
      "localPlatform": "windows",
      "input": {
        "encoding": "jsonObject",
        "value": {
          "version": 1,
          "type": "future_message",
          "eventID": "00000000-0000-4000-8000-000000000011",
          "source": "mac",
          "target": "windows",
          "timestamp": 1788000000,
          "pairingCode": "TEST-CODE-0001"
        }
      },
      "expected": {
        "accepted": false,
        "reason": "unknown_type",
        "refreshPeer": false,
        "replyTypes": [],
        "hardwareCalls": { "wake": 0, "switchDisplay": 0, "usbActions": 0 }
      }
    },
    {
      "id": "MSG-012",
      "description": "Unknown top-level field is ignored",
      "localPlatform": "mac",
      "input": {
        "encoding": "jsonObject",
        "value": {
          "version": 1,
          "type": "status_probe",
          "eventID": "00000000-0000-4000-8000-000000000012",
          "source": "windows",
          "target": "mac",
          "timestamp": 1788000000,
          "pairingCode": "TEST-CODE-0001",
          "futureField": "ignored"
        }
      },
      "expected": {
        "accepted": true,
        "reason": "accepted",
        "refreshPeer": true,
        "replyTypes": ["status_response"],
        "hardwareCalls": { "wake": 0, "switchDisplay": 0, "usbActions": 0 }
      }
    },
    {
      "id": "MSG-013",
      "description": "Missing required event ID is rejected",
      "localPlatform": "windows",
      "input": {
        "encoding": "jsonObject",
        "value": {
          "version": 1,
          "type": "handover_request",
          "source": "mac",
          "target": "windows",
          "timestamp": 1788000000,
          "pairingCode": "TEST-CODE-0001"
        }
      },
      "expected": {
        "accepted": false,
        "reason": "missing_field",
        "refreshPeer": false,
        "replyTypes": [],
        "hardwareCalls": { "wake": 0, "switchDisplay": 0, "usbActions": 0 }
      }
    },
    {
      "id": "MSG-014",
      "description": "String protocol version is rejected as the wrong field type",
      "localPlatform": "mac",
      "input": {
        "encoding": "jsonObject",
        "value": {
          "version": "1",
          "type": "status_probe",
          "eventID": "00000000-0000-4000-8000-000000000014",
          "source": "windows",
          "target": "mac",
          "timestamp": 1788000000,
          "pairingCode": "TEST-CODE-0001"
        }
      },
      "expected": {
        "accepted": false,
        "reason": "invalid_field_type",
        "refreshPeer": false,
        "replyTypes": [],